id,text
sn84021930,"/ ?
THE DOUGLAS ISLAND NEWS.
A. O. IcBRlOE. - - - CHA5. A. HOPP
Editors and Publishers.
PUBLISHED EVERY WEDNESDAY
? I
TERiYlS:?In Advance.
One Year - - ~ - - - $3.00,
Six Months 1.50
Three Months .... 1.00 i
Single Copies - - - .10
Foreign Postage must be Prepaid.
Wednesday, November 23,1898.
To Exchanges.
Our exchauges will please note the
removal of the News from Fort Wran-1
gel to Douglas City and Treadwell and }
govern themselves accordingly.
I
SALUTATORY.
We take pleasure iu herewith pre
senting to the people of Douglas City
and Treadwoll tho initial number of!
the Douglas Island News, which we j
earnestly trust will meet with your ex
pectations as an ideal local newspaper !
and merit a liberal support.
The live and prosperous towns of
Douglas City and Treadwell are cer |
tainly entitled to one good, wide-awake |
newspaper, and it will be our desire to !
supply this adjunct, that is so neces- j
sary to tho upbuilding of cities, and \
whether, or not, wo succeed in our ef-1
forts, we leave for you to judge.
The columus of this paper, with only I
slight exceptions, will be devoted to I
the publication of local events and \
Alaska news, and there being no mu-j
nicipal organizations or elections, its 1
pages will be for the present non-par
tisan.
Read our paper, observe its style and
make-up, aud, if it pleases you, give it
such support as it is entitled to, and
we will be satisfied.
Very respectfully,
A. G. McBride and
On as. A. Hopp,
tklitors and Publishers.
I
Where Is It?
Douglas City is located on Douglas j
island and joins the town of Treadwell, 1
where the greatest stamp mill in the j
world is operated. The towns of Doug- i
las City and Treadwell have all thej
branches of trade represented within '
their limits aud every dealer is doing a
prosperous business. The population j
is between 2500 and .'1000 people, and the
pay roll at the mines reaches close to
800 men, whiih, however will be in- j
creased to 1500 or 2000 within the next j
six months. There is one wharf at;
Douglas City and one at Treadwell.
These towns are two and one half i
miles from Juneau and a ferry boat
plies between the towns making five
trips a day, but which will soou be in-J
creased. New buildings are going up 1
in every direction and there is not an
empty store room or dwelling in town.
Rents are reasonable. The supply of
carpenters seems to be inadequate to !
the demand. The business men are all'
live, prosperous men and here to stay.
Money for any public enterprise is lib
erally supplied. A new 6J500 church;
is now in course of construction. If
you want to come to Alaska, come to
the future great town of the district,
Douglas City and Treadwell.
Always Solemn.
?very race of beings has its peeul- j
iarities and the most striking of the
Alaska Indian, is solemnity. Wher-1
ever you find the Indian you will ob- j
serve that same grave expression on his i
countenance. We have seen him at the ;
dance where ""joy was uncontined,"" j
with the feathers flying in every direc
tion and the dancers jumping, kicking
and puffing in such a manner as to sat
isfy the desire of the most enthusiastic
and ardent spectator, but not a smile
was visible. We have seen him by the
side of a coffin that held that which is
supposed to be ueareet and dearest to '
humanity, civilized or uncivilized, and
yet the same pensive look was upon his
face that we observed at the dance. We
have seen him at the grave, and as the !
dull, heavy thud of the clods of earth
covered the remains of a wife or child,
his solemnity seemed no more appar- (
ent than when he was roaming through
the forest in search of game.
We saw a young Indian and his wife ,
coming towards us on the sidwealk the :
other day. Just ahead of them was
their little two and a half year old babe <
which was slowly toddling along. They | ]
were both intently watching the child. 11
It was their first-born.' They were well 1
dressed and among the brightest of <
! /
their race. Did they smile as they
looked at the little tot as it wabbled
along 011 the sidewalk? No, indeed,
their faces were as expressionless as j
the outside of an imported Swiss
cheese. Love the little thing? Why
yes, as much as any mother and father
love their olfspring.
They are a sorrowful appearing race
and if you ever obsorve an expression
of mirthfuluess on their countenances
it is the exception and not the rule.
McGINTY IN SIGHT.
Narrow Escape of the Utopia on Her last Up
Trip. Tied Up at the Wharf. Did She
Violate the Law.
_
The little Sound steamer Utopia
came near, awful near, going to see Mc- '
Ginty at the bottom of the sea ou her !
last trip up and that she escaped the '
misfortune, borders closely on the mi-1
raculous. She made the trip up with- i
out mishap until she reached a place !
about twelve miles this side of Capo
Faushaw, at which place, where the'
channel is very wide, a lamp upsot in ;
the captain's cabin, which set the bed!
clothes on fira, which spread very rap-;
idly and soon burned the ropes of the j
steering gear. There being no other'
provision on the boat for steering, sho
rolled helplessly in the sea.
The confusion was intense among the ;
passengers, but the officers finally
launched the life raft which was at j
once pounded to pieces by the waves.;
A boat was next lowered aud a passen- 1
ger jumped into it, but the waves dash-1
ed it to pieces and there was one less !
of the passengers. By this time the |
crew got the hose coupled on aud tho j
pumps into action aud the tire was j
speedily extinguished aud order was
restored. Tho steering ropes were re-1
paired and tho plucky little boat made j
another start for this place, but luck
was still against her, and when she j
reached Taku inlet, alxnit fiftoeu miles
from this city and while in a place of
shelter, her wheel struck something and
off went two of her propeller blades, J
and within a few minutes off went the
third blade and then she was in a fix;!
she commenced drifting towards the
rocky beach, but as good fortune would !
have it, the Farallon happened to- lie
coming along aud she took the disa-J
bled boat in tow and safely brought
her to Juueau, where she now lies help-;
less aud forlorn.
If our understanding of the United
States laws is correct, every boat, and
especially that class which carry pas- j
sengers, is required to be provided
with relieving tackle, that is tackle !
which can be attached to the rudder,
lever so that in case the ropes are part
ed or destroyed, tho boat may still be
steered by this extra gear. Wo under-1
stand the Utopia is running without!
this relieving tackle and if so, why?
Perhaps the Seattle inspectors, who
frequently do some very careless work,
can explain the matter. If, as we are
informed, the Utopia has been violat- j
ing the law, in the manner indicated,
the cause for being allowed to do so
should be made known.
Steward Sanders,
While at Juneau laat Monday evening
the News man boarded the Topeka to
take a look at the ""wild Irishman"" who
has held the position of steward on
that boat since tho year 1.
""If you don't quit calling me an Irish
man we will have trouble,"" said Stew- '
ard Sanders to tho scribe, the moment j
he caught sight of the writer.
"" And if you don't quit lying about
your nationality tho office paralyzer
will be turned loose on you,"" was the
reply.
Sanders is a pretty good fellow, but
he will insist on calling himself a
Johnny Bull.
It Blew.
A severe wind storm has prevailed in ;
these parts for the past week, and it
made things hcwl. The News office
opened for business in a new building
with an uncompleted chimney, and for
two days and a half we were smoked 1
out of house and home. A galvanized |
extension was put up by contractor ;
Boyce last Sunday afternoon but at
about 11 o'clock that night it blew
down and scared three hours of sleep
and seven brilliant ideas out of the
senior editor. A coal famine has also
I
prevailed in the city and the wood we ;
were able to get was too wet to burn. J
But this did not end our trouble: our
I
foreman spent an hour trying to find j
a clean spot on our office towel and !
we lost that time also. Considering
the difficulties encountered, we feel
'
thankful that we have been able to is
sue this number before the holidays.
The Al-Ki was in port last week and
brought up a full cargo of freight. She
lid not go any further north than this :
place. She had her whistle with her
and bellowed and bawled around the
four wharves nearby for three or four
lays and then slid out for Seattle.
FROM UP THE COAST.
Deputy Collector Thomas Back. HIb Talk with
the News Man.
Mr. W. G. Thomas, a resident of
Alaska for the past twenty years, and
his most estimable wife, returned to
this part of Alaska recently. Mrs.
Thomas had pone from Fort VVrangel
to Juneau to meet her husband. Mr.
Thomas is direct from Kodiak where
he was deputy collector, having also
served in the same capacity in other |
portions of Alaska. Mr. Thomas was j
seon at his residence at VVrangel by a
News man, and when asked concerning
some of his Alaska experiences said: j
""I went to the Sand Point custom j
house 011 Popofi' island, in May, 1804,1
and remained there until May, 1800, at j
which time the custom house wns j
changed to Unga, on Unga island. In j
** io/u> r ? 1 4.? I
lUUy, louu, l was nuuoionuu i.u ivuuiuk
island, the distance between the two
being about 3(X) miles.""
""That must be a great country up
there,"" suggested the writer.
""Yes, Unga and Popoff islands are
treeless. The country is low and there
are no impediments to chock the wind.
Codfish are in abundance and two cur
ing stutions have boon there for years.
The Appollo mine is located about
four miles from Unga with forty
stamps aud a good output.""
""That must be a great place for
thought and reflection. Iiow terribly
lonesome you must have been up
there,"" said the News man.
""No, not near so much as one would
imagiuo. One becomes accustomed to
it and the time flies as rapidly as any
where. Wo had quite a little town at
Kodiak and, strange to say, there never
has been a saloon there. The people
supported mo in keeping the liquor
business out of tlie town. At Kodiak,
the climate is about the same as it is J
in Fort Wrangel. I wish to toll you I
also about some tree culture up in Un- j
alaska. Twenty years ago some one |
planted three treos at that place and !
they are all alive, but have not grown a '
particle. The place where the trees!
are planted is called The grove.' ""
Mr. and Mrs. Thomas showed the i
writer a beautiful collection of photo
graphic views taken in that part of
Alaska. Mr Thomas has kindly con- i
sented to give the News another inter- J
view concerning that country which wo !
know will interest our readers.
Her Troubles Ended.
Somo months ugo the little steamer !
Diana was libeled at Fort Wrangel at J
the instauco of a party named Barclay. |
Artwick Dahl is master of the vessel!
and he contested the action for all he I
is worth. The facts of the case were that
the boat was chartered for prospecting
purposes and in this enterprise Bar- j
clay the plaintiff was interested as a j
partner. Judge Suudtnaeher, of Fort
Wrangel, was appoiuted by Judge!
Johuson to take the evidence and sub-1
mit findings, which was done, resulting j
in a recommendation that the action j
be dismissed, which was confirmed by j
Judge Johnson, last Monday.
Capt. Dahl, when seen by a News1
man was very jubilant over the result j
of the action, and is especially pleased
with the work in getting this ground- j
less, though vexatious suit, dismissed.
I
DOUGLAS CITY.
The future great
city of Alaska is
located on Doug= |
!as island, across
the bay from Ju=
neau. Douglas
island is sixteen :
miles long and
nine miles at its j
widest place, and !
is practically a
mass of solid ore.
700 stamps will I
be in operation om
this island within
the next 5 months
The mines will
employ about
2000 men who
are paid good
wages every
month.
I !
OFFICIAL DIRECTORY OF ALASKA.
FOR THE DISTRICT OF ALASKA.
Governor?John G. Brady; private I
secretary, Mrs. Gertrude Knapp.
U. S. Judge?C. S. Johnson.
U. S. Attorney?Robert A.T?Yiedrick.
Assistant District Attorney?Alfred
J. Daly.
District Clerk?Albert D. Elliott.
Deputy Clerk?Joseph J. Rogers.
U. S. Marshal?J. M. Shoup.
Surveyor General?W. L. Distin.
Register?John W. Dudley.
Receiver?Roswell Shelly.
Court Interpreter?Goorge Kostro-1
metinoff.
Commissioners?C. W. Tuttle, Sitka;
John Y.Ostrander, Juneau; Fred P.Tus
tin, Fort Wrangel; L. R. Woodward,
Unalaska; Phillip Gallagher, Kodiak; 1
John U. Smith, Dyea; W. J. Jones, Cir- 1
cle City; Chas. H. Isham, Unga.
Deputy Marshals?W. A. McNair,
Sitka; Edward S. Staley, Juneau; W.
D. Grant, Fort Wrangel; R. Y. Street ;
Douglas; Edward C. Hasey, Kadiak; i
Lewis L. Bowers, Unga; J. C. Blaine, ,
Unalaska; F. M. Canton, Circle City; ,
Josias M. Tanner, Dyea.
Deputy Internal Revenue Collector?
W. C. Pedlar.
Educational Agont?Sheldon Jackson
Assistant Agont?William Hamilton.
Supt. of Schools?W. A. Kelly.
CUSTOMS OFFICERS.
.? ii ? i. t iir i
uoiiecwr?tj. w. ivc,v.
Special Deputy?W. P. McBride.
Deputy and Inspector?Win. Mill
rnore and C. L. Andrews.
Deputy Collectors?Joseph Arment, i
Fort Wrangel; E. M. VanSlyck, Mary
Island; W. G. Thomas, Kodiak; G. W.
Caton, Cook's Inlet; T. E. Holmes, Ka
riuk; J. F. Sinnot., Unga; J. P. Word,
Unalaska; E. T. Hatch, St. Michaels;
Chas. Smith, Circle City; John C. Ten
ny, Juneau.
Inspectors at Juneau?Loring K. Ad
ams, Harry Minto and John R. Auldin. ;
Inspectors at Fort Wrangel, Edward ! j
Hofstad, S. L. Adams, Geo. J. Smith, E.!
L. Hunter, Win. Denny.
Inspectors Afloat?J. S. Slater, S. F. !,
Hodges, L. H. Love joy, Edgar Grim.
Skaguay's Fire. h
On the evening of the 19th inst., a !
most disastrous fire occurred at Skag '
uay, which burned tho railroad offices i
which were located between tho Pacific
Coast wharf and Henry's dock. A liv
ery stablo with four horses and 1
some vehicles was also consumed in
the flames, besides one dwelling house.
The loss is estimated at $2b0,000.
Some of the railroad employees were j,
sleoping in tho office and they wore so !
badly burned that they are not expect- j
ed to survive.
* ""
An industry mat urcw.
The manufacture of tiu plate in this j
country calls for 1,000,000 tons of iron i
ore, .'100,(XX) tons of limestone, 2,(XX),000
tons of coal and coke, 400,(XX) tons of
pig iron, f>,(XX),(XX) pounds of lead, 13,
000,0(H) pounds of tallow and oil, 40,000
0(X) pounds of sulphuric acid, 12,000,000
feet of lumber. It gives employment
to .'IT),(XX) persons. Vet a few years ago
the Democratic press laughed at the
American tin industry as a joke and
an imposture.
La Motte's Mince and Pumpkin Pies ?
for Thanksgiving Day. Leave your or-;
ders early.
DR. W. L. HARRISON, |
DENTIST
Hunter Block, bet. Front
und 2nd Sts. Douglas City..
A. G. McBRIDE,
ATTORNEY AT LAW.
NOTARY PUBLIC.
Office with News. Douglas City, Alaska, j
'I
!
THE
i ?
STAR BREWERY,
DOUGLAS CITY.
nun <
JOHN EGAN, Proprietor.
WWW
w
THE NEW
BREWERY BUILD- ? |,
ING IS COMPLETED AND
OCCUPIED
0UR FACILlTIES^^OR^BREW~ '
ING FIRST-CLASS BEER
ARE NOT EXCELLED
IN ALASKA
/
THE STAR BREWERY
I
English Boats, Keep Off.
The Queen City, a small ateai ?r that
hails from Vancouver, and is on led by
an English company and marine by a
Canadian or English crew, mat her
initial trip to this country last week.
She had a small passenger list, a d, we
understand, can only accommoate a
few. Whether the passengers wre fed
on rotten tisli and second class Igrub,
which is the usual fare </n Hglish
boats, we don't know, but we will mger
a good hat that Americans will fa 3 ten
times as well on a straight Amrican
ship. A few months ago, an Eiflish
vessel landed at Fort Wraugel o her
way down and the passengers won to
the town restaurants and paid : >r a
square meal. We forget the nam of
the boat. She was a lino looking ves
sel and that is what fools so many peo
ple. If you are going to the Sound ake
a Pacific Coast Steamship Co. steaner,
or that of some other American Ine,
and you will get good quarters knd
first class meals.
It should not be forgotten that at
McKay's butcher shop, you can get
either a fine Turkey, Goose, Chicken or
Duck for your Thanksgiving diuter.
Prices reasonable.
& t it 4 ? ? *
Notice to creditors.
Before K. M. Jackson, Unites States
Commissioner for the District of Al
aska, holding court at Fort Wraa
gcl, Alaska.
In the matter of the estate of Shci
stack, an Indian, formerly ctlled
Hish-ta-day, deceased.
Notice is hereby givon by the under
signed, administrator of the estate of
Shustack, an Indian, formerly called
Hish-ta-day, deceased to the creditor#
of, and all persons having claim#
against the said deceased, to present
and exhibit them together with thenec
essary vouchers within six months after
the fourth publication of this notice,
to the undersigned administrator at
the office of Henry Drum Co., in the
town of Fort Wrangel, in the District
of Alaska, the same boing the place for
the transaction of the business of the
said estate in said town of Fort Wran
gel.
First publication Oct. 12th 1808.
Dated at Fort Wrangel, Alaska, this
12th day of October, 1808.
C. 11. SlJNlXMACHER,
Administrator of the estate of Shu
stack, an Indian, formerly called Hish
ta-day, deceased.
Prescriptions Filled
Day and Night at...
? Douglas Pharmacy.
! A Full Line of Toilet Articles,
i Perfumes,
^ Soaps,
</L Brashes,
Etc., Etc.
Hunter Bld'o Ud St., Douglas City.
THIS SPACE IS
RESERVED FO
R THE ALASK
A PHOTO CO
Ol-"" DOUGLAS**
CITY WATCH I
T GROW * * * *
G. ROENE,
Dealer in and Manufacturer of
^STOVES?
TIN- AND HARDWARE.
W?PLUMBING?W ^ ^
Doucrlas City. ? - ? Alaska.
3AM GLOVER Wm. HICKS
WWWW WWWWWW
I Seattle Billiard $
5 ...Hall... |
iHICKS & GLOVER, Props*
JwwwwwwwwwJ
LMie Only Billiard Tables in the City.
rront Street, - - Douglas City, Alaska.
The KLONDIKE
of douglas city.
Is a Gentlemen's Resort
j ' * - v
j S. GIUS, Proprietor.
Choicf Wines, Liquors, and Cigars.
/"
